{
  "$schema": "file:///docs/methodology/schema/v0.4.0-alpha.schema.json",
  "_source": {
    "changes": [
      "Phase-level advisory scaffolding",
      "Node-level advisory blocks (optional)",
      "Standardized predicate envelopes",
      "Per-entry version metadata"
    ],
    "from_version": "0.3.0",
    "transformation_date": "2025-10-23",
    "transformation_version": "0.4.0-alpha"
  },
  "global_gates": [
    {
      "applies_to": "door:one_way",
      "approvers": [
        "SA"
      ],
      "checks": [
        {
          "description": "ADR present with decision rationale",
          "id": "risk-1",
          "predicate": {
            "expected": "non-null",
            "field": "adr_ref",
            "kind": "node-field-present",
            "target": "$node"
          }
        },
        {
          "description": "Rollback plan documented in ADR",
          "id": "risk-2",
          "predicate": {
            "kind": "adr-has-section",
            "section": "rollback-plan",
            "target": "$node"
          }
        },
        {
          "description": "Spike evidence validates decision",
          "id": "risk-3",
          "predicate": {
            "evidence_type": "spike",
            "kind": "evidence-meets",
            "result": "meets",
            "target": "$node"
          }
        }
      ],
      "id": "G-Risk",
      "outcomes": [
        "pass",
        "rollback"
      ],
      "purpose": "High-risk decision validation (applies to all one-way doors)"
    },
    {
      "applies_to": "door:operational",
      "approvers": [
        "DEV"
      ],
      "checks": [
        {
          "description": "SLO/SLI defined",
          "id": "ops-1",
          "predicate": {
            "artifact_type": "slo",
            "kind": "artifact-exists",
            "target": "$node"
          }
        },
        {
          "description": "Alert rules configured",
          "id": "ops-2",
          "predicate": {
            "artifact_type": "alert-rules",
            "kind": "artifact-exists",
            "target": "$node"
          }
        },
        {
          "description": "Runbook documented",
          "id": "ops-3",
          "predicate": {
            "evidence_type": "ops_runbook",
            "kind": "evidence-meets",
            "result": "meets",
            "target": "$node"
          }
        }
      ],
      "id": "G-Operate",
      "outcomes": [
        "pass",
        "fix_forward"
      ],
      "purpose": "Operational readiness validation (applies to all operational decisions)"
    }
  ],
  "levels": [
    {
      "description": "Essential for any MCP server",
      "id": "required",
      "label": "Required"
    },
    {
      "description": "Important for production deployments",
      "id": "recommended",
      "label": "Recommended"
    },
    {
      "description": "Nice to have for advanced use cases",
      "id": "optional",
      "label": "Optional"
    }
  ],
  "phases": [
    {
      "advisory": {
        "anti_patterns": [],
        "conversation_starters": [
          "Will this server be used locally (CLI) or remotely (HTTP)?",
          "What naming pattern best fits your language ecosystem?"
        ],
        "decision_trees": [],
        "examples": [
          {
            "code": "from mcp.server.fastmcp import FastMCP\n\nmcp = FastMCP(\"weather-mcp\")\n\n@mcp.tool()\ndef get_weather(city: str) -> str:\n    return f\"Weather in {city}: Sunny, 72°F\"",
            "context": "Good starting point for local-first servers with simple tool interfaces",
            "description": "Minimal Python MCP server using stdio transport for local CLI usage",
            "title": "FastMCP stdio server"
          }
        ],
        "related_resources": [
          {
            "title": "MCP Specification",
            "type": "documentation",
            "url": "https://modelcontextprotocol.io/specification"
          }
        ],
        "success_criteria": [
          {
            "criterion": "Server name follows ecosystem convention",
            "evidence": "Package manifest file",
            "verification": "Check package.json or pyproject.toml for {service}_mcp or {service}-mcp-server pattern"
          }
        ],
        "templates": [
          {
            "content": "# ADR: [Decision Title]\n\n## Status\nProposed | Accepted | Deprecated\n\n## Context\n[What factors drove this decision?]\n\n## Decision\n[What did we decide?]\n\n## Consequences\n### Positive\n- [Benefit 1]\n\n### Negative\n- [Trade-off 1]\n\n## Rollback Plan\n[How to reverse this decision if needed]",
            "format": "markdown",
            "name": "MCP Server ADR Template"
          }
        ],
        "tool_recommendations": [
          {
            "purpose": "Python MCP server framework with minimal boilerplate",
            "tool": "FastMCP",
            "url": "https://github.com/jlowin/fastmcp"
          }
        ]
      },
      "color": "#3B82F6",
      "description": "Initial setup and foundational decisions for your MCP server project",
      "gate": {
        "applies_to": "phase",
        "approvers": [
          "SA",
          "DEV"
        ],
        "checks": [
          {
            "description": "ADR present for naming pattern decision",
            "id": "gs-gate-1",
            "predicate": {
              "expected": "non-null",
              "field": "adr_ref",
              "kind": "node-field-present",
              "target": "server-naming"
            }
          },
          {
            "description": "ADR present for transport mechanism",
            "id": "gs-gate-2",
            "predicate": {
              "expected": "non-null",
              "field": "adr_ref",
              "kind": "node-field-present",
              "target": "transport-selection"
            }
          },
          {
            "description": "Transport spike validates choice",
            "id": "gs-gate-3",
            "predicate": {
              "evidence_type": "spike",
              "kind": "evidence-meets",
              "result": "meets",
              "target": "transport-selection"
            }
          },
          {
            "description": "All required nodes completed",
            "id": "gs-gate-4",
            "predicate": {
              "condition": "status.state == done",
              "kind": "all-of",
              "query": {
                "level": "required",
                "phase": "getting-started"
              }
            }
          }
        ],
        "id": "getting-started-gate",
        "outcomes": [
          "pass",
          "fix_forward",
          "rollback"
        ],
        "purpose": "Foundational architecture decisions validated"
      },
      "id": "getting-started",
      "nodes": [
        {
          "advisory": {
            "anti_patterns": [
              {
                "example": "Bad: weather-mcp-v2 → Good: weather_mcp @ 2.0.0",
                "problem": "Including version numbers like weather-mcp-v2 couples identity to implementation",
                "solution": "Use semantic versioning in package.json/pyproject.toml, not in package name",
                "title": "Version in package name"
              }
            ],
            "examples": [
              {
                "code": "# pyproject.toml\n[project]\nname = \"weather_mcp\"\n\n# or for monorepo:\nname = \"acme-weather-mcp\"",
                "context": "Follows Python ecosystem conventions, discoverable via package search",
                "description": "Python MCP servers use underscore suffix",
                "title": "Python package naming"
              },
              {
                "code": "// package.json\n{\n  \"name\": \"@acme/weather-mcp-server\",\n  \"version\": \"1.0.0\"\n}",
                "context": "Follows npm conventions, clear server designation",
                "description": "Node.js MCP servers use hyphenated suffix",
                "title": "Node.js package naming"
              }
            ],
            "success_criteria": [
              {
                "criterion": "Package name uses ecosystem pattern",
                "evidence": "Package manifest follows convention",
                "verification": "Python: ends with _mcp; Node: ends with -mcp-server"
              }
            ],
            "templates": []
          },
          "decision_input": {
            "help": "Python: {service}_mcp, Node: {service}-mcp-server",
            "label": "Server Name",
            "pattern": "^[a-z0-9_-]+$",
            "placeholder": "analytics_mcp"
          },
          "door": "one_way",
          "effort": {
            "confidence": "high",
            "max": 20,
            "min": 15
          },
          "evidence_policy": [
            {
              "criteria": "Validate naming pattern across ecosystem examples",
              "required_at": "gate",
              "type": "spike"
            }
          ],
          "id": "server-naming",
          "level": "required",
          "status": {
            "state": "todo"
          },
          "summary": "Decide on naming convention: Python uses {service}_mcp, Node uses {service}-mcp-server",
          "tags": [
            "naming",
            "architecture"
          ],
          "title": "Choose server naming pattern",
          "why": "Consistent discoverability across ecosystem; avoid feature/version coupling"
        },
        {
          "advisory": {
            "anti_patterns": [],
            "examples": [],
            "success_criteria": [],
            "templates": []
          },
          "door": "one_way",
          "effort": {
            "confidence": "medium",
            "max": 45,
            "min": 25
          },
          "evidence_policy": [
            {
              "criteria": "Prototype transport mechanism with MCP SDK",
              "required_at": "gate",
              "type": "spike"
            }